{
  "request_id": "gr-001",
  "guard_id": "cep-callback-contract-guard",
  "guard_version": "1.0.0",
  "workspace_id": "example-cep",
  "reason": "The current caller may pass a non-function callback value.",
  "evidence_refs": [
    "memory:failure-pattern:cep-callback-non-function",
    "workspace:file:cep/client/app.js"
  ],
  "requested_mode": "inspect"
}
